{
  "country": "NL",
  "validFrom": "2021-12-05T00:00:00+01:00",
  "vaccineSpecs": [
    {
      "vaccineIds": [ "EU/1/20/1528" ],
      "comboSpecs": [
        {
          "combos": [ "1/1" ],
          "validity": null
        },
        {
          "combos": [ "2/2" ],
          "validity": 14
        },
        {
          "combos": [ "3/3", "3/2", "n/n, n > 3" ],
          "validity": 0
        }
        ]
    },
    {
      "vaccineIds": [ "EU/1/20/1525" ],
      "comboSpecs": [
        {
          "combos": [ "1/1" ],
          "validity": 28
        },
        {
          "combos": [ "2/2", "3/3", "n/n, n > 3" ],
          "validity": 0
        },
        {
          "combos": [ "3/2" ],
          "validity": null
        }
      ]
    }
  ],
  "maxValid": 365
}
